"Status","Start Time","Stop Time","Duration in ms","Parent Suite","Suite","Sub Suite","Test Class","Test Method","Name","Description"
"passed","Fri Oct 21 21:06:50 GMT 2022","Fri Oct 21 21:06:51 GMT 2022","637","","example to-do app with a checked task","","example to-do app with a checked task","can filter for uncompleted tasks","can filter for uncompleted tasks",""
"passed","Fri Oct 21 21:06:49 GMT 2022","Fri Oct 21 21:06:50 GMT 2022","732","","example to-do app","","example to-do app","can add new todo items","can add new todo items",""
"passed","Fri Oct 21 21:06:51 GMT 2022","Fri Oct 21 21:06:52 GMT 2022","1077","","example to-do app with a checked task","","example to-do app with a checked task","can filter for completed tasks","can filter for completed tasks",""
"passed","Fri Oct 21 21:06:48 GMT 2022","Fri Oct 21 21:06:49 GMT 2022","1172","","example to-do app","","example to-do app","displays two todo items by default","displays two todo items by default",""
"passed","Fri Oct 21 21:06:52 GMT 2022","Fri Oct 21 21:06:53 GMT 2022","1165","","example to-do app with a checked task","","example to-do app with a checked task","can delete all completed tasks","can delete all completed tasks",""
"passed","Fri Oct 21 21:06:50 GMT 2022","Fri Oct 21 21:06:50 GMT 2022","443","","example to-do app","","example to-do app","can check off an item as completed","can check off an item as completed",""
